team number,nickname,rookie year,full name,Nasa?,city,region,country,motto,# of events,event codes,event names
1,The Juggernauts,1997,The Chrysler Foundation/BAE Systems/Hirotec & Oakland Schools Technical Campus--Ne,,Pontiac,Michigan,USA,Real Winners are Ordinary People with Extraordinary Determination,2,"['2016miket', '2016mimar']","['FIM District - Kettering University Event #1', 'FIM District - Marysville Event']"
4,Team 4 ELEMENT,1997,BOEING/Sawing Services/Gibbs CAM/SolidWorks/Boston Scientific/WAAG/Roberts Tool Co./Full Scale Effects & High Tech La,,Van Nuys,California,USA,Igniting the flames of passion,2,"['2016calb', '2016cave']","['Los Angeles Regional', 'Ventura Regional']"
8,Team 8,1996,Google/Lockheed Martin/Bae Systems/Intuitive Surgical /Fenwick & West LLP/Webcor Builders/NVIDIA/Dropbox/Solidworks/Kirk's Steakburgers & Palo Alto High,,Palo Alto,California,USA,Making Humans Obsolete Since 1996,3,"['2016cama', '2016casj', '2016cur']","['Central Valley Regional', 'Silicon Valley Regional presented by Google.org', 'Curie Division']"
11,MORT,1997,Siemens/John & Margaret Post Foundation/National Defense Education Program/Givaudan/BAE Systems/ASCO/Chameleon Designs/Mt. Olive School District/Prevision Systems & Mt  Olive High,,Flanders,New Jersey,USA,"""Coming Together, Designing Together, Building Together, Succeeding Together""",5,"['2016cars', '2016flwp', '2016mrcmp', '2016njfla', '2016paphi']","['Carson Division', 'South Florida Regional ', 'Mid-Atlantic Robotics District Championship', 'MAR District - Mt. Olive Event', 'MAR District - Springside Chestnut Hill Event']"
16,Bomb Squad,1996,"Baxter Healthcare Corporation/The Science and Technology Group/Arkansas FIRST/Novak Technical Services, LLC & Mtn Home High Career Academics & Mountain Home Jr. High School",,Mountain Home,Arkansas,USA,Kick the tires and light the fires,3,"['2016alhu', '2016arlr', '2016new']","['Rocket City Regional', 'Arkansas Rock City Regional', 'Newton Division']"
20,The Rocketeers,1992,Global Foundries-Town of Malta Foundation/GE Volunteers and the GE Foundation/BAE SYSTEMS/Advanced Manufacturing Techniques Inc./NYSTAR and the Center for Automation Technologies and Systems at Rensselaer Polytechnic Institute & Shenendehowa High School,,Clifton Park,New York,USA,"Inspiration,  Integrity, Improvement",3,"['2016carv', '2016nyro', '2016nytr']","['Carver Division', 'Finger Lakes Regional ', 'New York Tech Valley Regional']"
21,ComBBAT,1998,The Boeing Company/SGT/Planet Fitness of Daytona/School Board of Brevard County/East Coast Machine/NASA GSDO/Indian River Tech/Florida Power & Light & Astronaut High School & Titusville High School,NASA,Titusville,Florida,USA,Who Dat Bat - ComBBAT,2,"['2016flor', '2016flwp']","['Orlando Regional', 'South Florida Regional ']"
25,Raider Robotix,1997,Bristol-Myers Squibb Co./American Alloy Fabricators/Abbe Lumber/Becton Dickinson & North Brunswick Twp High,,North Brunswick,New Jersey,USA,there's nothing beyond our reach,4,"['2016cur', '2016mrcmp', '2016njbri', '2016pahat']","['Curie Division', 'Mid-Atlantic Robotics District Championship', 'MAR District - Bridgewater-Raritan Event', 'MAR District - Hatboro-Horsham Event']"
27,Team RUSH,1997,BorgWarner/Mclaren Health Care/FCA Foundation/State Of Michigan /Smith's Disposal/Genisys Credit Union/Clarkston Dermatology/DENSO/TRW/BAE/Applied Manufacturing Technologies/3-Dimensional Services/ARC Investments/Recticel North America Inc./Clarkston Rotary/Chase Plastics /De-sta-co/DAWNCo/Financial Benifits Group/DMT Homes /Faurecia/Superior Buick GMC & Clarkston High School,,Clarkston,Michigan,USA,Never Give Up,5,"['2016carv', '2016mibro', '2016micmp', '2016miliv', '2016ohcl']","['Carver Division', 'FIM District - Woodhaven Event', 'Michigan State Championship', 'FIM District - Livonia Event', 'Buckeye Regional']"
28,Pierson Whalers,1996,Ancora Yacht Service/Ship Ashore Marina & Pierson Middle/High School,,Sag Harbor,New York,USA,Work Smoothly=Life Time Piece,1,['2016nyli'],['SBPLI Long Island Regional']
31,Prime Movers,1997,Williams/OSDE/AEP/Boeing/National Defense Education Program & Jenks Hs,,Jenks,Oklahoma,USA,,2,"['2016mokc', '2016okok']","['Greater Kansas City Regional', 'Oklahoma Regional ']"
33,Killer Bees,1996,Fiat Chrysler Automotive/The FCA Foundation/Innovation First International/TI Automotive/JDM Consulting/Elite Fence Products/Hubbard Spring/Lochbridge/BAE Systems/Aicas & Notre Dame Preparatory,,Auburn Hills,Michigan,USA,Teamwork Keeps the Hive Alive,4,"['2016micmp', '2016mitry', '2016miwat', '2016tes']","['Michigan State Championship', 'FIM District - Troy Event', 'FIM District - Waterford Event', 'Tesla Division']"
34,Rockets,1997,Limestone County Board of Education/Limestone County Legislative Delegation/Society of Women Engineers & Limestone County Gifted Program & Limestone Co Area Voc Tech,,Athens,Alabama,USA,FIRST in Alabama,2,"['2016alhu', '2016arlr']","['Rocket City Regional', 'Arkansas Rock City Regional']"
41,RoboWarriors,1997,Watchung Hills Reg H,,Warren,New Jersey,USA,,5,"['2016cars', '2016cmp', '2016mrcmp', '2016njfla', '2016njski']","['Carson Division', 'Einstein Field', 'Mid-Atlantic Robotics District Championship', 'MAR District - Mt. Olive Event', 'MAR District - Montgomery Event']"
45,TechnoKats Robotics Team,1992,"Delphi/AndyMark, Inc./Duke Energy/Foresite/Kokomo Education Foundation/Royal United Mortgage/1Up! Software/HMH Contractors, Inc./Howard County EMA/Indiana Wesleyan University/Kati L. Taylor/Kokomo Area Career Center Collision Repair & Construction Class/Kokomo Area Lions Club/Midwestern Engineers, Inc./Northwest Radiology Network/ProPrints & Kokomo High School",,Kokomo,Indiana,USA,,4,"['2016arc', '2016incmp', '2016inpmh', '2016inwla']","['Archimedes Division', 'Indiana State Championship', 'IN District - Perry Meridian Event', 'IN District - Tippecanoe Event']"
48,Delphi E.L.I.T.E.,1998,Delphi Corporation/Nordson XALOY & Warren G Harding High School,,Warren,Ohio,USA,Encouraging Learning In Technology and Engineering,5,"['2016new', '2016nytr', '2016ohci', '2016ohsc', '2016paca']","['Newton Division', 'New York Tech Valley Regional', 'Queen City Regional', 'Ohio FRC State Championship', 'Greater Pittsburgh Regional']"
51,The Wings of Fire,1996,GM Powertrain/Delphi/Chrysler Foundation/The Ford Foundation/BAE Systems/Chief Financial Credit Union/Genisys Credit Union/AWG Systems/Methode & Pontiac Schools,,Pontiac,Michigan,USA,You get out of this program what you put into it!,4,"['2016cars', '2016micmp', '2016mihow', '2016miwat']","['Carson Division', 'Michigan State Championship', 'FIM District - Howell Event', 'FIM District - Waterford Event']"
53,Area 53,1998,Army Research Laboratory/Maryland Space Business Roundtable & Eleanor Roosevelt High,,Greenbelt,Maryland,USA,Seeking Intelligence,2,"['2016mdblr', '2016mdedg']","['CHS District - Northern Maryland Event', 'CHS District - Central Maryland Event']"
56,R.O.B.B.E.,1997,Ethicon & Bound Brook High,,Bound Brook,New Jersey,USA,"""To teach, to learn, to inspire.""",3,"['2016mrcmp', '2016njfla', '2016njski']","['Mid-Atlantic Robotics District Championship', 'MAR District - Mt. Olive Event', 'MAR District - Montgomery Event']"
57,Leopards,1998,Hydraquip Custom Systems Inc./Andy's Hardware/Arc Specialties/CenterPoint Energy Give/Chevron/Country Pure Foods/Employee Owned Holdings Inc./ExxonMobil/Hydraquip Distribution Inc./GE Sensing/Walter P. Moore & Washington B T H S,,Houston,Texas,USA,We make a difference by leaving our leopard spots,2,"['2016carv', '2016txho']","['Carver Division', 'Lone Star Regional']"
58,The Riot Crew,1996,Fairchild Semiconductor/Robotics Institute of Maine & South Portland High School,,South Portland,Maine,USA,The Riot Crew,3,"['2016marea', '2016melew', '2016week0']","['NE District - North Shore Event', 'NE District - Pine Tree Event', 'Week 0']"
59,RamTech,1997,Sal Aerospace Engineering (SAE) / Miami Coral Park Sr. / Beckman Coultour / Florida Power & Light / eMerge of Americas & Miami Coral Park Senior High,,Miami,Florida,USA,R.A.M.S (Right Attitude Means Success),1,['2016flwp'],['South Florida Regional ']
60,Bionic Bulldogs,1997,"KUSD #20 Kingman High School/Kingman Academy of Learning High School/Chrysler Foundation/Laron Incorporated/Purvis Industries/Brackett Aircraft/Potters, Inc/Praxair/Sutton Funeral Home/3-Systems and the Coca Cola Company/Mohave County Block Grant/I Corp/West Coast Netting/Kingman Regional Medical Center/True Value/Coast Aluminum /Freiday Construction/Data Max and Wecom & Kingman High School & Kingman Academy of Learning - High School & Lee Williams High School",,Kingman,Arizona,USA,Fabricating Futures,3,"['2016azfl', '2016cars', '2016nvlv']","['Arizona North Regional', 'Carson Division', 'Las Vegas Regional']"
63,McDowell Robotics Team 63,1997,Millcreek Township School District/GE Volunteers & Mcdowell Hs,,Erie,Pennsylvania,USA,Wearing the same shirts doesn't make a team,2,"['2016ohci', '2016ohcl']","['Queen City Regional', 'Buckeye Regional']"
66,Grizzly Robotics,1998,General Motors Corp/Michigan Department of Education/ZF & Ypsilanti STEMM Middle College,,Ypsilanti,Michigan,USA,Inspiring Our Youth With Technology!,4,"['2016miann', '2016micmp', '2016misjo', '2016tes']","['FIM District - Ann Arbor Skyline Event', 'Michigan State Championship', 'FIM District - St. Joseph Event', 'Tesla Division']"
67,The HOT Team,1997,General Motors Milford Proving Ground & Huron Valley Schools,,Highland,Michigan,USA,Heroes Of Tomorrow,4,"['2016micmp', '2016mihow', '2016miwat', '2016new']","['Michigan State Championship', 'FIM District - Howell Event', 'FIM District - Waterford Event', 'Newton Division']"
68,Truck Town Thunder,1998,General Motors/Michigan Department of Education/Fiat Chrysler Automobiles Foundation/Esys Automation/Continental Automotive Systems/ARL Service/Cross the Road Electronics/Michigan Renaissance Festival/CEC Controls & Brandon High School & Holly High School,,Ortonville,Michigan,USA,"Transforming Culture with Traction, Teamwork and Inspiration",5,"['2016gal', '2016inwla', '2016micmp', '2016mihow', '2016milan']","['Galileo Division', 'IN District - Tippecanoe Event', 'Michigan State Championship', 'FIM District - Howell Event', 'FIM District - Lansing Event']"
69,HYPER,1998,Bluefin Robotics & Quincy Public Schools,,Quincy,Massachusetts,USA,Helping Youth Pursue Engineering and Robotics,2,"['2016mabos', '2016manda']","['NE District - Boston Event', 'NE District - UMass-Dartmouth Event']"
70,More Martians,1998,General Motors/State of Michigan/Fiat Chrysler Automotive Foundation/Kettering University/Patti Engineering/Leoni/Midstates Bolt & Screw Co./Burkland/Mid Michigan Robotics Alliance & Goodrich High School,,Goodrich,Michigan,USA,Two heads are better than one,4,"['2016hop', '2016micmp', '2016mihow', '2016miket']","['Hopper Division', 'Michigan State Championship', 'FIM District - Howell Event', 'FIM District - Kettering University Event #1']"
71,Team Hammond,1996,School City of Hammond / Caterpillar / City of Hammond / Bemcor International & Area Career Center,,Hammond,Indiana,USA,,3,"['2016incmp', '2016inpmh', '2016inwch']","['Indiana State Championship', 'IN District - Perry Meridian Event', 'IN District - Walker Warren Event']"
73,The Illumination,1995,"ME Engineering/RIT FIRST Club/Ron Zarrella & Rochester Science, Technology, Engineering and Mat",,Rochester,New York,USA,,1,['2016nyro'],['Finger Lakes Regional ']
74,Team C.H.A.O.S.,1995,Haworth Inc./Profile Films/PTC/SpinDance/EBW Electronics/Magna/Brain and Spine Center/Disher/Grand Valley State University/Trans-Matic/River City Metals/Russells Technical Products/A.D. Bos Vending Services & Holland High School & Black River Public School,,Holland,Michigan,USA,Every problem has a solution,5,"['2016inwch', '2016micmp', '2016mitvc', '2016miwmi', '2016tes']","['IN District - Walker Warren Event', 'Michigan State Championship', 'FIM District - Traverse City Event', 'FIM District - West Michigan Event', 'Tesla Division']"
75,RoboRaiders,1996,J&J Consumer and Personal Products Worldwide - & Hillsborough High,,Hillsborough,New Jersey,USA,,3,"['2016mrcmp', '2016njbri', '2016njfla']","['Mid-Atlantic Robotics District Championship', 'MAR District - Bridgewater-Raritan Event', 'MAR District - Mt. Olive Event']"
78,AIR STRIKE,1996,Naval Undersea Warfare Center/The de Ramel Foundation/DOD STEM/BAE Systems/CVS Health Foundation/KVH Industries/Raytheon/Rite-Solutions & Aquidneck Island Robotics 4-H Club,,Newport,Rhode Island,USA,Teaching Through Competitive Robotics,5,"['2016carv', '2016manda', '2016necmp', '2016nhgrs', '2016week0']","['Carver Division', 'NE District - UMass-Dartmouth Event', 'New England District Championship', 'NE District - Granite State Event', 'Week 0']"
79,Team Krunch,1998,"Honeywell Aerospace/Career Technical Education Foundation, Inc./GE & East Lake High School",,Tarpon Springs,Florida,USA,It's Krunch Time,2,"['2016alhu', '2016flor']","['Rocket City Regional', 'Orlando Regional']"
81,MetalHeads,1994,Honeywell/Freeport School District 145/Ultrasonic Power Corporation/Trez Turning/Morse Electric/Kiwanis Clubs of Freeport/RestorX/Papa Murphy's/Atkins Energy/Culver's of Freeport & Freeport High School & Lena-Winslow High School,,Freeport,Illinois,USA,The Next Elements in Robotics,1,['2016ilpe'],['Central Illinois Regional']
85,B.O.B. (Built on Brains),1996,"Herman Miller Foundation/System Components, Inc/Trans-matic/NUVAR Incorporated/ITW  Drawform/Request Foods/Lakeshore Cutting/Mead Johnson Nutritionals/ODL/Gentex/Midway Machine Techlologies/Town & Country Group/Plascore/Consumers Energy/Global Concepts & Zeeland West High School & Zeeland East High School",,Zeeland,Michigan,USA,Built on Brains,4,"['2016carv', '2016micmp', '2016milak', '2016miwmi']","['Carver Division', 'Michigan State Championship', 'FIM District - Lakeview Event', 'FIM District - West Michigan Event']"
86,Team Resistance,1998,"JEA/VISTAKON Johnson and Johnson Vision Care Products/Black and Veatch Engineering/Johnson Controls, Inc. & Stanton College Preparatory",,Jacksonville,Florida,USA,Going Against the Current!,2,"['2016flor', '2016flwp']","['Orlando Regional', 'South Florida Regional ']"
87,Red Devils,1997,Lockheed Martin/COMCAST/NAVSEA & NDEP/CPS Metals/AndyMark/Chick-Fil-A & Rancocas Valley Reg H,,Mount Holly,New Jersey,USA,"""FIRST you go to Robotics, then you can go ANYWHERE!""",3,"['2016flwp', '2016njtab', '2016pahat']","['South Florida Regional ', 'MAR District - Seneca Event', 'MAR District - Hatboro-Horsham Event']"
88,TJ(Squared),1996,Harpak-ULMA / Highland Power Corp & Bridgewater-Raynham Reg,,Bridgewater,Massachusetts,USA,Oh Yeah!,5,"['2016gal', '2016manda', '2016necmp', '2016nhgrs', '2016week0']","['Galileo Division', 'NE District - UMass-Dartmouth Event', 'New England District Championship', 'NE District - Granite State Event', 'Week 0']"
93,NEW Apple Corps,1997,Plexus Corp./Appleton Area School District & Tesla Engineering Charter School & East High & North High & West High,,Appleton,Wisconsin,USA,"Simul possumus, simul volumus",2,"['2016ilpe', '2016mndu']","['Central Illinois Regional', 'Lake Superior Regional']"
94,The  Technojays,1998,Lear Corporation/Denso Corporation/FORD MOTOR COMPANY & Southfield High School,,Southfield,Michigan,USA,BLUEJAYS SOAR-Standing Out Above the Rest,2,"['2016misou', '2016mitvc']","['FIM District - Southfield Event', 'FIM District - Traverse City Event']"
95,Grasshoppers,1997,Hartford Area Career and Technology Center/Byrne Foundation/NASA/BAE Systems/NDEP/CRREL/Hypertherm & Hartford Area Career and Technology Center,NASA,White River Junction,Vermont,USA,Be Awesome,4,"['2016manda', '2016necmp', '2016nhdur', '2016nhgrs']","['NE District - UMass-Dartmouth Event', 'New England District Championship', 'NE District - UNH Event', 'NE District - Granite State Event']"
97,Bionic Beef,1996,"Akamai Technologies/Draper Laboratories/Vecna Technologies, Inc & Cambridge Rindge and Latin",,Cambridge,Massachusetts,USA,,2,"['2016marea', '2016ripro']","['NE District - North Shore Event', 'NE District - Rhode Island Event']"
100,The WildHats,1998,"Woodside High School Foundation/Sequoia Union High School District/Tate Family/Pentair/Lawrence Searcy/Barnes & Associates Insurance/Woodcraft/Solutions2Projects, LLC/Intuitive Surgical/Microsemi Corporation/SRI International/Recology San Mateo County/Brin Wojcicki Foundation/John & Jane Shroyer/SolidWorks/Alan Steel and Supply Company & Woodside High",,Woodside,California,USA,"""Student Run, Student Built""",2,"['2016cada', '2016casj']","['Sacramento Regional', 'Silicon Valley Regional presented by Google.org']"
101,Striker,1997,St Patrick High School,,Chicago,Illinois,USA,Go Shamrocks!,1,['2016ilch'],['Midwest Regional']
102,The Gearheads,1998,"Janssen Pharmaceuticals Inc. / Piccatinny Arsenal / Air Liquide / PSEG / Central Jersey Trailer and Hitch LLC / Alloy Welding Company, Inc. / Gerber Metal Supply Company / Dr. Victor J. Bauer & Somerville High",,Somerville,New Jersey,USA,GEARing Up for Success,3,"['2016mrcmp', '2016njski', '2016njtab']","['Mid-Atlantic Robotics District Championship', 'MAR District - Montgomery Event', 'MAR District - Seneca Event']"
103,Cybersonics,1997,"Amplifier Research/Hot Chalk/Lutron Electronics, Inc/PHTool/Tyndale/BAE Systems/Fred Beans Automotive/Stokes Manufacturing/Harro Hoflinger/Client Link & Palisades Hs",,Kintnersville,Pennsylvania,USA,Vision. Pasion. Commitment,4,"['2016new', '2016njski', '2016paphi', '2016pawch']","['Newton Division', 'MAR District - Montgomery Event', 'MAR District - Springside Chestnut Hill Event', 'MAR District - Westtown Event']"
107,Team R.O.B.O.T.I.C.S.,1997,Metal Flow/Tommy's Express Car Wash/Grand Valley State University/World Class Prototypes/Koops/Twisthink & Holland Christian High School,,Holland,Michigan,USA,Team R.O.B.O.T.I.C.S. ,4,"['2016arc', '2016micmp', '2016mista', '2016miwmi']","['Archimedes Division', 'Michigan State Championship', 'FIM District - Standish-Sterling Event', 'FIM District - West Michigan Event']"
108,SigmaC@T Robotic Team,1995,Motorola Solutions Foundation / Florida Power & Light / Broward County Public Schools & Dillard High School,,Ft. Lauderdale,Florida,USA,"""Teamwork through Technology""",2,"['2016flor', '2016flwp']","['Orlando Regional', 'South Florida Regional ']"
111,WildStang,1996,"Motorola Solutions Foundation / Methode Electronics / Township High School District 214 / Numerical Precision, Inc. / Nu-Way Industries / Lendrix / Magnetic Inspection Laboratory / Just Manufacturing / Automatic Precision & Rolling Meadows High School & Wheeling High School & Prospect High School & John Hersey High School",,Arlington Heights,Illinois,USA,WildStang,3,"['2016ilch', '2016ilpe', '2016tes']","['Midwest Regional', 'Central Illinois Regional', 'Tesla Division']"
114,Eagle Strike,1997,Google / Western Digital / Lockheed Martin / Intuitive Surgical / Applied Welding Technology / Advanced Component Technology / Los Altos High School & Los Altos High,,Los Altos,California,USA,,2,"['2016cada', '2016casj']","['Sacramento Regional', 'Silicon Valley Regional presented by Google.org']"
115,MVRT,1998,"Fremont Union High School Foundation/Apple/Qualcomm/Intuitive Surgical/Brin-Wojcicki Foundation/Western Digital/Apprion, Inc/Lockheed Martin/EMC2/De Anza College Machine Shop/Pinnacle Manufacturing & Monta Vista High",,Cupertino,California,USA,,2,"['2016casj', '2016utwv']","['Silicon Valley Regional presented by Google.org', 'Utah Regional']"
116,Epsilon Delta,1996,NASA Headquarters & Herndon High,NASA,Herndon,Virginia,USA,From small differences come big changes,3,"['2016chcmp', '2016vados', '2016vahay']","['FIRST Chesapeake District Championship sponsored by Booz Allen Hamilton', 'CHS District - Central Virginia Event', 'CHS District - Northern Virginia Event']"
117,The Steel Dragons,1998,4moms / The Thorn Family / The Heinz Endowments  / FIRST FRC Hardship Grants  / KuzElectric inc & Pittsburgh Allderdice Hs,,Pittsburgh,Pennsylvania,USA,"Get it done, then make it better",1,['2016paca'],['Greater Pittsburgh Regional']
118,Robonauts,1997,NASA-JSC & Clear Creek H S,NASA,League City,Texas,USA,,5,"['2016alhu', '2016cmp', '2016new', '2016onto', '2016txho']","['Rocket City Regional', 'Einstein Field', 'Newton Division', 'Greater Toronto East Regional ', 'Lone Star Regional']"
120,Cleveland's Team,1995,NASA Glenn Research Center/Cuyahoga Community College/GrafTech Corporation/Rockwell Automation & Youth Technology Academy,NASA,Cleveland,Ohio,USA,All for ONE--Cleveland's Team!,5,"['2016carv', '2016cmp', '2016ohci', '2016ohcl', '2016scmb']","['Carver Division', 'Einstein Field', 'Queen City Regional', 'Buckeye Regional', 'Palmetto Regional']"
121,Rhode Warriors,1996,NDEP/Raytheon/Town of Middletown/Blowfish/Ferreira-Fenton Fund & Middletown High School,,Newport County,Rhode Island,USA,Quality Robots Since 1996,2,"['2016mabos', '2016manda']","['NE District - Boston Event', 'NE District - UMass-Dartmouth Event']"
122,NASA Knights,1997,NASA Langley Research Center/New Horizons Regional Education Center/Precision Sheet Metal Fabrication LLC/TE Connectivity Foundation/Fastenal/Rose Precision Machine & Butler Farm Campus,NASA,Hampton,Virginia,USA,Inspire at all costs,4,"['2016chcmp', '2016new', '2016vados', '2016vapor']","['FIRST Chesapeake District Championship sponsored by Booz Allen Hamilton', 'Newton Division', 'CHS District - Central Virginia Event', 'CHS District - Hampton Roads Event']"
123,Team - Cosmos,1997,"GM Detroit Hamtramck Assembly/General Motors Foundation/Ford Motor/Design Systems, Inc/Wayne Metro Community Action Agency /Wayne State University Formula SAE/DADARA/State of Michigan & Hamtramck High School",,Hamtramck,Michigan,USA,Share our similarities and celebrate our differences ,4,"['2016hop', '2016micen', '2016micmp', '2016misou']","['Hopper Division', 'FIM District - Center Line Event', 'Michigan State Championship', 'FIM District - Southfield Event']"
125,NUTRONs,1998,Northeastern University / Textron Systems / Sonos Inc. / United Technologies / National Grid / PTC / BAE Systems & Boston Latin & Brookline High & Revere High,,Boston,Massachusetts,USA,Uhhh....Strap???,7,"['2016azfl', '2016mabos', '2016melew', '2016necmp', '2016new', '2016ripro', '2016week0']","['Arizona North Regional', 'NE District - Boston Event', 'NE District - Pine Tree Event', 'New England District Championship', 'Newton Division', 'NE District - Rhode Island Event', 'Week 0']"
126,Gael Force,1992,Nypro Inc. & Clinton Senior High,,Clinton,Massachusetts,USA,Molding the Future,4,"['2016mabos', '2016mawor', '2016necmp', '2016new']","['NE District - Boston Event', 'NE District - WPI Event', 'New England District Championship', 'Newton Division']"
128,The Botcats,1997,"American Electric Power/Grandview Heights Marble Cliff Education Foundation/Grandview Bobcat Boosters, Inc. & Grandview Heights High School",,Grandview Heights,Ohio,USA,"Student Designed, Student Built, Student Run -  Mentor Approved",3,"['2016ohci', '2016ohsc', '2016paca']","['Queen City Regional', 'Ohio FRC State Championship', 'Greater Pittsburgh Regional']"
131,C.H.A.O.S.,1995,"BAE SYSTEMS / Rockwell Automation / Solid Works / Intelitek Inc / CHAOS Families / Best Buy Foundation / Cronin Bisson & Zalinsky, Attorneys at Law & Manchester Central High School &  4-H Hillsborough County, NH",,Manchester,New Hampshire,USA,You can't stop us!,2,"['2016nhdur', '2016nhgrs']","['NE District - UNH Event', 'NE District - Granite State Event']"
133,B.E.R.T.,1997,ITS Inc./Lockheed Martin/Robotics Institute of Maine & Bonny Eagle High School,,Standish,Maine,USA,Building Engineers One Robot at a Time,4,"['2016carv', '2016marea', '2016melew', '2016necmp']","['Carver Division', 'NE District - North Shore Event', 'NE District - Pine Tree Event', 'New England District Championship']"
135,Penn Robotics,1998,PHM Educational Foundation/Renesas & Penn High School,,Mishawaka,Indiana,USA,"Blood, Sweat, and Gears",4,"['2016cars', '2016incmp', '2016inpmh', '2016inwla']","['Carson Division', 'Indiana State Championship', 'IN District - Perry Meridian Event', 'IN District - Tippecanoe Event']"
136,Killer Kardinals,1997,"Plainfield Board of Education / Ivy Visions, Inc. & Plainfield High",,Plainfield,New Jersey,USA,"""Champions Under Construction!""",2,"['2016njski', '2016paphi']","['MAR District - Montgomery Event', 'MAR District - Springside Chestnut Hill Event']"
138,Entropy,1996,Monarch Instrument / Rockwell Automation / BAE Systems / SvenGrafik / Control Air / John Alberts Welding / Rapid Sheet Metal / Amherst Lions Club / County Stores / BB Mold & Souhegan Coop High School,,Amherst,New Hampshire,USA,We Love Torque,2,"['2016nhdur', '2016nhgrs']","['NE District - UNH Event', 'NE District - Granite State Event']"
141,WOBOT,1995,"JR Automation Technologies, LLC / Holland Board of Public Works / Koop & Burr Insurance / Bradford Company / Engineered Automation Systems, Inc. / Suntec Services / Rutherford & Associates / Egemin Automation / Tric Tool, Ltd.  & West Ottawa High School Campus",,Holland,Michigan,USA,We can do more.,4,"['2016carv', '2016flwp', '2016misjo', '2016miwmi']","['Carver Division', 'South Florida Regional ', 'FIM District - St. Joseph Event', 'FIM District - West Michigan Event']"
144,The R.O.C.K,1994,"Clippard Instruments / P&G / The Kroger Company / Skyline Chili / Craftsman Electric / TP Mechanical  / Cincinnati Test Systems / MSA, Architects / Alliance Robotics / Northgate Greenhouses & Butler Tech - Colerain High School & Butler Tech - Northwest High School",,Cincinnati,Ohio,USA,What is your quest?,3,"['2016ohci', '2016ohsc', '2016paca']","['Queen City Regional', 'Ohio FRC State Championship', 'Greater Pittsburgh Regional']"
