team number,nickname,rookie year,full name,Nasa?,city,region,country,motto,# of events,event codes,event names
1880,Warriors of East Harlem,2006,Bloomberg & East Harlem Tutorial Program,,New York,New York,USA,East Harlem's Finest!,2,"['2016nyny', '2016nyro']","['New York City Regional', 'Finger Lakes Regional ']"
1884,Griffins,2006,Bloomberg LP / Providence Equity Partners L.L.C. / GMT Communications Partners / Bechtel & The American School in London,,London,England,United Kingdom,,1,['2016nyny'],['New York City Regional']
1885,ILITE Robotics,2006,US STEM Foundation / NetApp / Lockheed Martin / Macedon Technologies / DataSync Technologies / ASCO / A-1 Flood Tech / Prince William County Schools & Battlefield High,,Haymarket,Virginia,USA,Inspiring Leaders In Technology and Engineering,4,"['2016chcmp', '2016cur', '2016mdbet', '2016vapor']","['FIRST Chesapeake District Championship sponsored by Booz Allen Hamilton', 'Curie Division', 'CHS District - Greater DC Event', 'CHS District - Hampton Roads Event']"
1891,Bullbots,2006,Micron Technology/Plexus & Mountain View High School,,Meridian,Idaho,USA,It's just a prototype,2,"['2016idbo', '2016utwv']","['Idaho Regional', 'Utah Regional']"
1895,Lambda Corps,2006,"Lockheed Martin/Micron Technology, Inc./Manassas City Public Schools Education Foundation, INC/Aerojet Rocketdyne Foundation & Osbourn High",,Manassas,Virginia,USA,Shoot for the stars. Fly with the Eagles.,3,"['2016chcmp', '2016mdblr', '2016vahay']","['FIRST Chesapeake District Championship sponsored by Booz Allen Hamilton', 'CHS District - Northern Maryland Event', 'CHS District - Northern Virginia Event']"
1896,Concussive Engineers,2006,"General Motors/Grand Traverse Manufacturers' Golf Outing/Cone Drive Operations, Inc. & Tba Career Tech Center",,Traverse City,Michigan,USA,,2,"['2016mimid', '2016mitvc']","['FIM District - Midland Event', 'FIM District - Traverse City Event']"
1899,Saints Robotics,2006,Microsoft/OSPI/Bellevue Schools Foundation & Interlake Senior High School,,Bellevue,Washington,USA,Ingenuity. Honor. Strength.,2,"['2016waamv', '2016wasno']","['PNW District - Auburn Mountainview Event', 'PNW District - Glacier Peak Event']"
1902,Exploding Bacon,2006,"Lockheed Martin / Magnus Hi-Tech / NASA / Electronic Arts / BAE Systems / Comcast NBC Universal / Disney VoluntEARS / Stage Equipment and Lighting / Castle Ventures / Central Florida Chapter Fluid Power Society / Firehouse Subs of Clermont Florida / Elise Cronin-Hurley Web & Graphic Design & Orange County 4-H, Florida",NASA,Orlando,Florida,USA,Where Pigs Fly,3,"['2016alhu', '2016carv', '2016flor']","['Rocket City Regional', 'Carver Division', 'Orlando Regional']"
1908,ShoreBots,2006,NASA / US Navy / BAE Systems -Norfolk Ship Repair / Rommel's ACE Hardware / Onancock Building Supply / Northampton County Education Foundation / Northampton County High School Alumni / Northampton County Public Schools / Exmore Rotary Club / Cape Charles Rotary / Exmore Rotary Club / Yuk Yuk and Joes / Onancock Rotary Club & Northampton High,NASA,Eastville,Virginia,USA,We are the shorebots,2,"['2016vados', '2016vapor']","['CHS District - Central Virginia Event', 'CHS District - Hampton Roads Event']"
1912,Team Combustion,2006,"NASA Stennis Space Center / Naval Research Laboratory / DoDSTEM / Aerojet Rocketdyne / Textron Marine & Land / Gulf Coast Pain Institute / Lew Family / Geocent, Inc. / CLECO / American Nuclear Society / Nakamoto Family / St. Tammany Parish School Board / Alliance Laser & Northshore High School & Salmen High School",NASA,Slidell,Louisiana,USA,Spreading the Wildfire,2,"['2016lake', '2016tnkn']","['Bayou Regional', 'Smoky Mountains Regional']"
1915,MTHS Firebird Robotics,2006,NASA Headquarters / Bechtel / Dept. of Defense STEM / Capitol Technology University / DC Public Schools & Mckinley Technology Hs,NASA,Washington,District of Columbia,USA,"No Excuses, Just Solutions",2,"['2016mdbet', '2016mdedg']","['CHS District - Greater DC Event', 'CHS District - Central Maryland Event']"
1918,NC GEARS,2006,Newaygo County Regional Educational Service Agency/The Fremont Area Community Foundation/The Gerber Foundation/Kaydon Bearings/The people of Newaygo County & Newaygo County Career Tech Center,,Fremont,Michigan,USA,Just Meshing Around ,4,"['2016cars', '2016micmp', '2016mista', '2016miwmi']","['Carson Division', 'Michigan State Championship', 'FIM District - Standish-Sterling Event', 'FIM District - West Michigan Event']"
1920,McMain Hurricanes,2006,Orleans Parish Public Schools & Eleanor Mcmain Secondary School,,New Orleans,Louisiana,USA,"""Eliminating, One Robot At A Time",1,['2016lake'],['Bayou Regional']
1922,Oz-Ram,2006,MicroDaq.com Ltd & Hopkinton High School & John Stark Regional High School & Hopkinton Middle School,,Contoocook/Weare,New Hampshire,USA,The Tin Men!,2,"['2016melew', '2016nhdur']","['NE District - Pine Tree Event', 'NE District - UNH Event']"
1923,The MidKnight Inventors,2006,Bloomberg / Goldman Sachs / NRG / Bristol Myers Squibb / Citibank / United Therapeutics / SolidWorks / Friends & Families of 1923 / Michael Baker International & Wwindsor  Plainsboro North & Wwindsor  Plainsboro South,,Plainsboro,New Jersey,USA,You never forget your FIRST robotics.,4,"['2016arc', '2016mrcmp', '2016njfla', '2016njski']","['Archimedes Division', 'Mid-Atlantic Robotics District Championship', 'MAR District - Mt. Olive Event', 'MAR District - Montgomery Event']"
1927,Tempest,2006,NDEP/NASA/Stennis Space Center/Huntington Ingalls Industries/Mississippi Power Company/BAE Systems/Argosy Foundation /Newman's Own Foundation & St Patrick Catholic High School,NASA,Biloxi,Mississippi,USA,Building Lives:  One Heartache at a Time,1,['2016lake'],['Bayou Regional']
1937,Elysium,2006,Google / Omri Insurance Agency / Malat IAI / Hi-Cut / Municipality of Modi'in-Maccabim-Reut / Lior Shemer Furniture / Alumayer Group / Keren Lahaim Foundation / National Instruments / Omen Group / PL Group / Neot Reu't Foundation & Mor & MOR High School,,Modi'in-Maccabim Reu't,HaMerkaz (Central),Israel,,1,['2016ista'],['Israel Regional']
1939,THE KUHNIGITS,2006,THE BARSTOW SCHOOL,,Kansas City,Missouri,USA,That rabbit is dynamite!,4,"['2016cars', '2016mokc', '2016mosc', '2016ohci']","['Carson Division', 'Greater Kansas City Regional', 'Missouri Robotics State Championship', 'Queen City Regional']"
1940,The Tech Tigers,2006,Whirlpool Corporation / Benton Harbor Area Schools & Benton Harbor High School,,Benton Harbor,Michigan,USA,"We just dont think it, we build it",2,"['2016miken', '2016misjo']","['FIM District - East Kentwood Event', 'FIM District - St. Joseph Event']"
1942,Tel-Nof,2006,IAF-ASSOCIATION/ROBOTEC TECNOLOGIES(INTELITEK)/IAF-DEPOT 22 & 0RT ISRAEL & ORT TEL NOF,,Gadera,HaMerkaz (Central),Israel,,1,['2016ista'],['Israel Regional']
1943,Neat Team,2006,ONE1 / municipality of Rosh Ha'ain & begin high scool,,Rosh Hayin,HaMerkaz (Central),Israel,,1,['2016ista'],['Israel Regional']
1944,Airforce High School,2006,SRT/Israel Air force/Omega Air & Airforce High School ,,Haifa,Haifa,Israel,,1,['2016ista'],['Israel Regional']
1954,ElectroBunny,2006,Rash foundation & AMAL RAMOT BEER SHEVA,,Beer Sheva,HaDarom (Southern),Israel,Everything is done by ourselves,1,['2016ista'],['Israel Regional']
1965,Firebirds,2006,EMC Corporation/Analog Devices Inc/Raytheon/PTC & Saint Joseph Preparatory High School,,Boston,Massachusetts,USA,,2,"['2016mabos', '2016marea']","['NE District - Boston Event', 'NE District - North Shore Event']"
1967,The Janksters,2006,Apple / Qualcomm / BAE Systems / Brin Wojcicki Foundation / Intuitive Surgical / NVIDIA / Kirkland Family / TechShop / SolidWorks & Notre Dame High School,,San Jose,California,USA,"It may not be perfect, But that's where the magic begins",2,"['2016cama', '2016casj']","['Central Valley Regional', 'Silicon Valley Regional presented by Google.org']"
1972,Searing Engineering,2006,Lowe's/Imperial Valley MESA & Central Union High,,El Centro,California,USA,When's Kick-Off?!,1,['2016casd'],['San Diego Regional']
1973,Brighton Burning Tiger,2006,Gelfand Family Foundation/Gentle Giants Moving Company/Textron Corporation/Harvard Business School/Boston Scientific/Irene Chan/Tufts University/MIT/Boston University College of Engineering & Brighton High,,Boston,Massachusetts,USA,Keep On Burning Brightly,3,"['2016arc', '2016mawor', '2016ripro']","['Archimedes Division', 'NE District - WPI Event', 'NE District - Rhode Island Event']"
1977,Loveland High Robotics PowerSquids,2006,Northrop Grumman/Lockheed Martin/Prosci/PTC & Loveland High School,,Loveland,Colorado,USA,,1,['2016code'],['Colorado Regional']
1982,Cougar Robotics,2007,BlueScope Construction / Black & Veatch / M.E. Group / Wood by Design / Shawnee Mission Education Foundation & Shawnee Mission Northwest High,,Shawnee,Kansas,USA,,1,['2016mokc'],['Greater Kansas City Regional']
1983,Skunk Works Robotics,2007,The Boeing Company / Lockheed Martin / OmanTek / BLR Aerospace / Alaska Airlines / OMAX / Champion and Assoc. / AHS PTSA & Raisbeck Aviation High School,,Seattle,Washington,USA,"Be Quick, be Quiet, and Be On Time...",5,"['2016cur', '2016orphi', '2016pncmp', '2016waamv', '2016waell']","['Curie Division', 'PNW District - Philomath Event', 'Pacific Northwest District Championship sponsored by Autodesk', 'PNW District - Auburn Mountainview Event', 'PNW District - Central Washington University Event']"
1984,Raider Revolution Robotics,2007,Kansas City Power and Light/Honeywell Hometown Solutions/Ewing Marion Kauffman Foundaton/Shawnee Mission Education Foundation & Shawnee Mission South High,,Overland Park,Kansas,USA,Putting the Pieces Together,1,['2016mokc'],['Greater Kansas City Regional']
1985,Robohawks,2007,The Boeing Company / Monsanto Fund / Hazelwood School District  / HCHS Student Council & Pep Club & Hazelwood Central High,,Florissant,Missouri,USA,,3,"['2016mosc', '2016mosl', '2016ohci']","['Missouri Robotics State Championship', 'St. Louis Regional', 'Queen City Regional']"
1986,Team Titanium,2007,"TradeBot / Venture Industrial Products / Best Buy / National Instruments / Michael & Jayne Hartwig / Shawn & Kristen Roy / Clarcor Inc. / Delmer & Ruth Harris / Dr. Tom Cates / Honeywell FM&T / Intuitive Surgical, Inc / IBM / American Century Investments / US Engineering / Paradise Park / Mr. Longarm / Tod Stafford / Metals USA / Dairy Queen / Kastle Grinding / CK Enterprises / Billy Goat Industries & Lee's Summit West High",,Lee's Summit,Missouri,USA,Engineering Engineers,5,"['2016arc', '2016cmp', '2016mokc', '2016mosc', '2016tnkn']","['Archimedes Division', 'Einstein Field', 'Greater Kansas City Regional', 'Missouri Robotics State Championship', 'Smoky Mountains Regional']"
1987,Broncobots,2007,"Best Buy / Kastle Grinding / Brunson Instruments / MJB Insurance Services, Inc / Show Me Controls / KC Stem Alliance / Laird Plastics / Painted with Powder / Fastenal / Phoenix Manufacturing / David Darling / Wentworth Technology Solutions / R&D Tool and Engineering / Lone Oak Lawns / Edwina Smith / Helen Settle / Jake's Performance Fabrication / Lee's Summit Tribune / Jon Plaas / Grider Orthodontics / Stonehaus Winery / Settle Family & Lee'S Summit North High",,Lees Summit,Missouri,USA,,4,"['2016cars', '2016mokc', '2016mosc', '2016txlu']","['Carson Division', 'Greater Kansas City Regional', 'Missouri Robotics State Championship', 'Hub City Regional']"
1989,Viking Robotics,2007,Picatinny Arsenel & Vernon Twp High,,Vernon Township,New Jersey,USA,Where Steel and Intelligence Clash,3,"['2016mrcmp', '2016njbri', '2016njski']","['Mid-Atlantic Robotics District Championship', 'MAR District - Bridgewater-Raritan Event', 'MAR District - Montgomery Event']"
1991,Dragons,2007,"Pratt & Whitney / University of Hartford / NASA / Hartford Public Schools / Tsunami Tsolutions / Tallan / Satellite Tool & Machine Co., Inc. / Nutmeg StateFederal Credit Union / Aetna / Lagana Florist / AL Fire Protection / Schneider Electric Motion & University High School",NASA,Hartford,Connecticut,USA,Failure is Not an Option,4,"['2016cthar', '2016ctsc', '2016ctwat', '2016cur']","['NE District - Hartford Event', 'Connecticut State Championship', 'NE District - Waterbury Event', 'Curie Division']"
1994,Horse Power!,2007,Kansas City Kansas Public Schools/KC Stem Alliance & F L Schlagle High,,Kansas City,Kansas,USA,,1,['2016mokc'],['Greater Kansas City Regional']
1997,Stag Robotics,2007,Bishop Miege High School / Friends of STAGrobotics / Garmin Industries / KC STEM Alliance / TG Construction / Altec Industries & Bishop Miege High School,,Roeland Park,Kansas,USA,We Solve Problems,1,['2016mokc'],['Greater Kansas City Regional']
2001,HERMES,2007,Hickman Mills School District / Best Buy / KC STEM Alliance & Ruskin High School,,Kansas City,Missouri,USA,We can rebuild it ... We have the technology,1,['2016mokc'],['Greater Kansas City Regional']
2002,Tualatin Robotics,2007,"Bentley Systems, Incorporated/The Boeing Company/Rockwell Collins/Mentor Graphics/Oregon Department of Education/Flir/Tigard Tualatin  School District/Innovation Academy & Tualatin High School",,Tualatin,Oregon,USA,"Design, Build, Compete, Win!",2,"['2016orore', '2016orwil']","['PNW District - Clackamas Academy of Industrial Science Event', 'PNW District - Wilsonville Event']"
2004,Thunderducks,2007,Tulsa Technology Center,,Tulsa,Oklahoma,USA,No killing,1,['2016okok'],['Oklahoma Regional ']
2010,Lightning Bots,2007,Delphi Corporation / Cleveland Communication / NASA & Champion High School,NASA,Warren,Ohio,USA,,2,"['2016nyro', '2016ohcl']","['Finger Lakes Regional ', 'Buckeye Regional']"
2013,Cybergnomes,2007,Molded Plastic Consultants/Inventure Engineering & Machinery Inc/JT Snowmobile/Page Graphics/Clearview Township/Honda of Canada Manufacturing/Stayner Lions Club/MS Parts/Stayner Kinsmen/Prodomax Automation/Advanced Automation/Weld Experts & Cybergnomes Robotics,,Clearview Township,Ontario,Canada,You'll never see us coming!,4,"['2016abca', '2016hop', '2016onnb', '2016onto']","['Western Canada Regional', 'Hopper Division', 'North Bay Regional', 'Greater Toronto East Regional ']"
2016,Mighty Monkey Wrenches,2007,Johnson & Johnson Consumer and Personal Products Worldwide / nrg / DOTC STEM Picatinny / National Defense Education Program / New Jersey School for the Deaf / Morris Millwork / Ewing Township Education Association & Ewing High,,Ewing,New Jersey,USA,Heavy Metal Monkey Business,4,"['2016mrcmp', '2016njtab', '2016ohci', '2016pahat']","['Mid-Atlantic Robotics District Championship', 'MAR District - Seneca Event', 'Queen City Regional', 'MAR District - Hatboro-Horsham Event']"
2022,Titan Robotics,2007,Caterpillar Inc/Mad Lab Industries & Il Mathematics & Science Academy,,Aurora,Illinois,USA,"Measure twice, cut once",2,"['2016ilch', '2016ilpe']","['Midwest Regional', 'Central Illinois Regional']"
2027,Robotic Dragons,2007,Westbury High School & Westbury High School,,Old Westbury,New York,USA,,1,['2016nyli'],['SBPLI Long Island Regional']
2028,Phantom Mentalist,2007,"Community Knights / Best Buy / National Defense Education Program / SPAWAR Systems Center Atlantic / Lockheed Martin / Science Systems and Applications, Inc. (SSAI) / McSmith Engineering / Swisslog Logistics / Huntington Ingalls Industries / Newport News Shipbuilding Apprentice School / Hampton City Schools & Phoebus High",,Hampton,Virginia,USA,We know what you're thinking,3,"['2016chcmp', '2016vados', '2016vapor']","['FIRST Chesapeake District Championship sponsored by Booz Allen Hamilton', 'CHS District - Central Virginia Event', 'CHS District - Hampton Roads Event']"
2035,Robo Rockin' Bots,2007,Carmel Unified School District / Naval Post Graduate School / National Defense Education Program / Monterey Bay Aquarium Research Institute / Brin Wojciciki Foundation / FOCUS / Padre Parents / El Camino Machine and Welding / SJ Automation & Carmel High,,Carmel,California,USA,Taking it to eleven since 2007,3,"['2016cada', '2016casj', '2016new']","['Sacramento Regional', 'Silicon Valley Regional presented by Google.org', 'Newton Division']"
2036,The Black Knights,2007,Medtronic/minuteKEY/Ball Aerospace & Technologies Corp/Quick Left & Fairview High School,,Boulder,Colorado,USA,"""At least it didn't catch on fire""",1,['2016code'],['Colorado Regional']
2039,Rockford Robotics,2007,"Superior Joining Technologies, Inc  / UTC AEROSPACE SYSTEMS / WOODWARD, INC. / Rockford Robotics Association & Neighborhood Group",,Rockford,Illinois,USA,Think outside the 'bots.,2,"['2016ilch', '2016ilpe']","['Midwest Regional', 'Central Illinois Regional']"
2040,DERT - Dunlap Eagles Robotics Team,2007,Caterpillar / TE Connectivity / ABB / Stellar Systems & Dunlap High School,,Dunlap,Illinois,USA,"To grow leaders, FIRST you need a little DERT",2,"['2016ilpe', '2016ohci']","['Central Illinois Regional', 'Queen City Regional']"
2046,Bear Metal,2007,The Boeing Company / Washington State OSPI / Flow International Corporation / Alaska Airlines / Google & Tahoma Senior High School,,Maple Valley,Washington,USA,It goes to 11,5,"['2016hop', '2016orphi', '2016pncmp', '2016waahs', '2016waamv']","['Hopper Division', 'PNW District - Philomath Event', 'Pacific Northwest District Championship sponsored by Autodesk', 'PNW District - Auburn Event', 'PNW District - Auburn Mountainview Event']"
2048,The Pink Panthers,2007,"Detroit Public Schools / Comcast / DADARA / Gentherm / DTE Energy / 2014 FRC Hardship Grant, MEZ / FORD / VDV Concessions,LLC / MEZ & Detroit International Academy for Young Women",,Detroit,Michigan,USA,Made with a woman's touch,2,"['2016micen', '2016misou']","['FIM District - Center Line Event', 'FIM District - Southfield Event']"
2051,The Beattie Bulldogs,2007,Caterpillar Inc./Aerotech Inc./PTI & a W Beattie Career Center,,Allison Park,Pennsylvania,USA,Run With the Pack,2,"['2016ohci', '2016paca']","['Queen City Regional', 'Greater Pittsburgh Regional']"
2052,KnightKrawler,2007,Medtronic/Groves Foundation/Best Buy/Pentair Foundation & Irondale Senior High,,New Brighton,Minnesota,USA,,5,"['2016cars', '2016cmp', '2016mndu', '2016mnmi', '2016mnsc']","['Carson Division', 'Einstein Field', 'Lake Superior Regional', 'Minnesota 10000 Lakes Regional', 'Minnesota State High School League State Championships']"
2053,TigerTronics,2007,Microsoft/BAE Systems/Lockheed Martin/Empire Plastics/North Point Technology & Union Endicott High School & Vestal Senior High School,,Endicott,New York,USA,Extinction is not an option,2,"['2016nyli', '2016paca']","['SBPLI Long Island Regional', 'Greater Pittsburgh Regional']"
2054,Tech Vikes,2007,General Motors Grand Rapids / Sebright Products / Midway Chevrolet of Plainwell / Ed Koehn Ford & Hopkins High School,,Hopkins,Michigan,USA,Together Everyone Achieves More,4,"['2016micmp', '2016miken', '2016miwmi', '2016tes']","['Michigan State Championship', 'FIM District - East Kentwood Event', 'FIM District - West Michigan Event', 'Tesla Division']"
2056,OP Robotics,2007,CNC Woodcraft / Gridpath Solutions / Juice Matters / Innovation First International / HWDSB & Orchard Park Secondary School,,Stoney Creek,Ontario,Canada,Perseverance Develops Character,5,"['2016cmp', '2016onto', '2016onwa', '2016onwi', '2016tes']","['Einstein Field', 'Greater Toronto East Regional ', 'Waterloo Regional ', 'Windsor Essex Great Lakes Regional', 'Tesla Division']"
2059,The Hitchhikers,2007,Optimist International/United Therapeutics/Best Buy Children's Foundation/IBM/Duke Energy/ASME & Athens Drive High,,Apex,North Carolina,USA,BE THE NEXT LEADERS!,4,"['2016ncash', '2016ncbui', '2016nccmp', '2016ncral']","['NC District - UNC Asheville Event', 'NC District - Campbell University/Johnston Community College Event', 'NC FIRST Robotics State Championship', 'NC District - Wake County Event']"
2062,C.O.R.E  2062,2007,Rockwell Automation/GE Volunteers/Toshiba/SMC/InSinkErator/Punch Manufacturing/TLX/School District of Waukesha/SCORE & Waukesha Engineering Preparatory Academy & West High & South High & North High,,Waukesha,Wisconsin,USA,Core Values,2,"['2016ilch', '2016wimi']","['Midwest Regional', 'Wisconsin Regional']"
2064,The Panther Project,2007,United Technologies / PTC / Nexus Design / Ace Hardware & Pomperaug Regional High School,,Southbury / Middlebury,Connecticut,USA,,5,"['2016arc', '2016ctsc', '2016ctwat', '2016necmp', '2016ripro']","['Archimedes Division', 'Connecticut State Championship', 'NE District - Waterbury Event', 'New England District Championship', 'NE District - Rhode Island Event']"
2067,Apple Pi,2007,"Bishop's Orchards / United Technologies / Rockwell Automation / Moroso Performance Products / Intuitive Surgical / Andersen Windows and Doors & 4-H of New Haven County, CT",,Guilford,Connecticut,USA,How 'bout them apples?,6,"['2016cars', '2016cthar', '2016ctsc', '2016mawor', '2016necmp', '2016ripro']","['Carson Division', 'NE District - Hartford Event', 'Connecticut State Championship', 'NE District - WPI Event', 'New England District Championship', 'NE District - Rhode Island Event']"
2068,Metal Jackets,2007,"Lockheed Martin/Booz Allen Hamilton/BAE Systems/Micron Technology/SPARK Education Foundation/Prince William County Public Schools/Pro-Type Industries, INC./Orbital Sciences/Stellar Solutions Inc. & Osbourn Park High",,Manassas,Virginia,USA,Defend the Hive,3,"['2016chcmp', '2016mdblr', '2016vahay']","['FIRST Chesapeake District Championship sponsored by Booz Allen Hamilton', 'CHS District - Northern Maryland Event', 'CHS District - Northern Virginia Event']"
2070,Royals,2007,Ridgefield Board of Education/Ridgefield PTA/Picatinny STEM/General Devices/DoDSTEM & Ridgefield Memorial High,,Ridgefield,New Jersey,USA,,2,"['2016njfla', '2016njski']","['MAR District - Mt. Olive Event', 'MAR District - Montgomery Event']"
2073,EagleForce,2007,Siemens Mobility & Pleasant Grove High,,Elk Grove,California,USA,,2,"['2016cada', '2016cama']","['Sacramento Regional', 'Central Valley Regional']"
2075,Enigma Robotics,2007,Wege Foundation / Barebulb Company / Rescom Electric / Dick & Betsy DeVos Foundation / Lakelind Electric / Soule / Repair Technologies LLC / Armen Oumedian / GE Volunteers & West Catholic High School,,Grand Rapids,Michigan,USA,,2,"['2016miken', '2016miwat']","['FIM District - East Kentwood Event', 'FIM District - Waterford Event']"
2077,Laser Robotics,2007,GE Volunteers / Rockwell Automation / Milwaukee Tool / MSOE / FAS / Meyers Electric / CBRE-Environmental Systems Inc. / Sharp Packaging Systems Inc. / x-keys / Carbide Grinding / Delzer / Buchanan Family / Dr. Raymond Moy & Kettle Moraine High,,Wales,Wisconsin,USA,Danger! Danger!,2,"['2016arlr', '2016wimi']","['Arkansas Rock City Regional', 'Wisconsin Regional']"
2079,4H ALARM Robotics,2007,"United Technologies, Pratt & Whitney/Rolls Royce, Marine Division/ALARM Robotics/General Electric Volunteers/Acorn Animal Hospital & 4-H ALARM Robotics 2079",,Franklin,Massachusetts,USA,faciendo discimus,2,"['2016mabos', '2016mawor']","['NE District - Boston Event', 'NE District - WPI Event']"
2080,Torbotics,2007,H Rocker Electric/Lockheed Martin/NASA & Hammond High School,NASA,Hammond,Louisiana,USA,Together Opening Realms Beyond Our Team Into our Community and Schools,3,"['2016cur', '2016lake', '2016txho']","['Curie Division', 'Bayou Regional', 'Lone Star Regional']"
2081,Icarus,2007,Caterpillar Inc/Advanced Technology Services/Martin Engineering/Riverside Tool & Die Company/Wentzel Engraving & Peoria Notre Dame High School & Richwoods High School & Kewanee High School,,Peoria,Illinois,USA,"If it doesn't work, try something else.",3,"['2016ilpe', '2016mosl', '2016new']","['Central Illinois Regional', 'St. Louis Regional', 'Newton Division']"
2083,Team BLITZ,2007,Lockheed Martin & Conifer Senior High School,,Conifer,Colorado,USA,"Brainstorm, Build , Believe, Be the Future",1,['2016code'],['Colorado Regional']
2084,Robots by the C,2007,Spaulding Education Fund / The Hooper Fund / Manchester Masons / MIT Lincoln Lab / Pinpoint Laser Systems / Cape Ann Savings Bank / Lee Spence & Manchester Essex Regional High School,,Manchester,Massachusetts,USA,GO TEAM!,3,"['2016mabos', '2016marea', '2016necmp']","['NE District - Boston Event', 'NE District - North Shore Event', 'New England District Championship']"
2085,RoboDogs,2007,Solano County Office of Education / Genentech in cooperation with VPEF / Vacaville Sunrise Rotary Club / Vacaville Public Education Foundation / Recology / Pacific Gas and Electric / Tencate / Robinson Family / Peterson Family / Haddox Consulting Engineers / Alexander Family & Vacaville High,,Vacaville,California,USA,,2,"['2016cada', '2016idbo']","['Sacramento Regional', 'Idaho Regional']"
2090,Buff 'n Blue,2007,Sam O. Hirota Engineering/Leidos/Friends of Hawaii Robotics/Min Plastics & Punahou School,,Honolulu,Hawaii,USA,"Work hard, play hard.",1,['2016hiho'],['Hawaii Regional']
2095,Direct Current,2007,the Episcopal Academy,,Newtown Square,Pennsylvania,USA,,2,"['2016pahat', '2016paphi']","['MAR District - Hatboro-Horsham Event', 'MAR District - Springside Chestnut Hill Event']"
2096,RoboActive,2007,Home Skinovations / Hoodies / Israel Ministry of Education / World Ort Education for Life / Negev nucler reserch center  / medisim / Dead sea works (concil) / Amal / Bar Ba Negev / 3D systems & Zinman high school,,dimona,HaDarom (Southern),Israel,Robotics is more than just robots,1,['2016ista'],['Israel Regional']
2102,Team Paradox,2007,McCarthy Family Foundation / Nordson-Asymtek / ViaSat / Premier Stainless / AFCEA San Diego / Qualcomm / San Dieguito High School Academy  Associated Student Body / Families of Team 2102 & San Dieguito High Academy & San Dieguito High Academy,,Encinitas,California,USA,Passion FIRST,3,"['2016cada', '2016casd', '2016new']","['Sacramento Regional', 'San Diego Regional', 'Newton Division']"
2106,The Junkyard Dogs,2007,Luck Stone Corporation / Rockwell Automation & Goochland High & Goochland Middle,,Goochland,Virginia,USA,,2,"['2016vabla', '2016vados']","['CHS District - Southwest Virginia Event', 'CHS District - Central Virginia Event']"
